{
  "source": "PHB v3.5",
  "chapter": "Magic",
  "section": "Spell List â€” Druid (Core, v2)",
  "schema_version": "1.0",
  "fields": ["id", "spell_id", "level"],
  "rows": [
    { "id": "LIST_DRUID_CURE_LIGHT_WOUNDS", "spell_id": "SPELL_CURE_LIGHT_WOUNDS", "level": 1 },
    { "id": "LIST_DRUID_ENTANGLE", "spell_id": "SPELL_ENTANGLE", "level": 1 },
    { "id": "LIST_DRUID_BARKSKIN", "spell_id": "SPELL_BARKSKIN", "level": 2 },
    { "id": "LIST_DRUID_DISPEL_MAGIC", "spell_id": "SPELL_DISPEL_MAGIC", "level": 4 },
    { "id": "LIST_DRUID_HEAL", "spell_id": "SPELL_HEAL", "level": 7 }
  ]
}
