{
  "source": "PHB v3.5",
  "chapter": "Equipment",
  "section": "Adventuring Gear (Table 7–8, core subset)",
  "schema_version": "1.0",
  "fields": ["id", "name", "cost_gp", "cost_sp", "cost_cp", "weight_lb", "notes"],
  "rows": [
    { "id": "AG_BACKPACK", "name": "Backpack (empty)", "cost_gp": 2, "weight_lb": 2, "notes": "Counts as 1 lb when worn, where applicable." },
    { "id": "AG_BARREL", "name": "Barrel (empty)", "cost_gp": 2, "weight_lb": 30, "notes": "" },
    { "id": "AG_BASKET", "name": "Basket (empty)", "cost_sp": 4, "weight_lb": 1, "notes": "" },
    { "id": "AG_BEDROLL", "name": "Bedroll", "cost_sp": 1, "weight_lb": 5, "notes": "Counts as 1 lb when worn, where applicable." },
    { "id": "AG_BELL", "name": "Bell", "cost_gp": 1, "weight_lb": 0, "notes": "" },
    { "id": "AG_BLANKET_WINTER", "name": "Blanket, winter", "cost_sp": 5, "weight_lb": 3, "notes": "Counts as 1 lb when worn, where applicable." },
    { "id": "AG_BLOCK_TACKLE", "name": "Block and tackle", "cost_gp": 5, "weight_lb": 5, "notes": "" },
    { "id": "AG_BOTTLE_WINE_GLASS", "name": "Bottle, wine, glass", "cost_gp": 2, "weight_lb": 0, "notes": "" },
    { "id": "AG_BUCKET", "name": "Bucket (empty)", "cost_sp": 5, "weight_lb": 2, "notes": "" },
    { "id": "AG_CALTROPS", "name": "Caltrops", "cost_gp": 1, "weight_lb": 2, "notes": "" },
    { "id": "AG_CANDLE", "name": "Candle", "cost_cp": 1, "weight_lb": 0, "notes": "" },
    { "id": "AG_CANVAS_SQYD", "name": "Canvas (sq. yd.)", "cost_sp": 1, "weight_lb": 1, "notes": "" },
    { "id": "AG_CASE_MAP_OR_SCROLL", "name": "Case, map or scroll", "cost_gp": 1, "weight_lb": 0.5, "notes": "" },
    { "id": "AG_CHAIN_10FT", "name": "Chain (10 ft.)", "cost_gp": 30, "weight_lb": 2, "notes": "Hardness 10; 5 hp; burst DC 26." },
    { "id": "AG_CHAWK", "name": "Chalk, 1 piece", "cost_cp": 1, "weight_lb": 0, "notes": "" },
    { "id": "AG_CHEST", "name": "Chest (empty)", "cost_gp": 2, "weight_lb": 25, "notes": "" },
    { "id": "AG_CROWBAR", "name": "Crowbar", "cost_gp": 2, "weight_lb": 5, "notes": "+2 circumstance bonus on certain Strength checks." },
    { "id": "AG_FIREWOOD_PER_DAY", "name": "Firewood (per day)", "cost_cp": 1, "weight_lb": 20, "notes": "" },
    { "id": "AG_FISHHOOK", "name": "Fishhook", "cost_sp": 1, "weight_lb": 0, "notes": "" },
    { "id": "AG_FISHING_NET_25SQFT", "name": "Fishing net, 25 sq. ft.", "cost_gp": 4, "weight_lb": 5, "notes": "" },
    { "id": "AG_FLASK_EMPTY", "name": "Flask (empty)", "cost_cp": 3, "weight_lb": 1.5, "notes": "Holds 1 pint." },
    { "id": "AG_FLINT_STEEL", "name": "Flint and steel", "cost_gp": 1, "weight_lb": 0, "notes": "" },
    { "id": "AG_GRAPPLING_HOOK", "name": "Grappling hook", "cost_gp": 1, "weight_lb": 4, "notes": "Use Rope DC 10 (+2 per extra 10 ft.)." },
    { "id": "AG_HAMMER", "name": "Hammer", "cost_sp": 5, "weight_lb": 2, "notes": "Improvised weapon if used in combat." },
    { "id": "AG_INK_1OZ", "name": "Ink (1 oz. vial)", "cost_gp": 8, "weight_lb": 0, "notes": "" },
    { "id": "AG_INKPEN", "name": "Inkpen", "cost_sp": 1, "weight_lb": 0, "notes": "" },
    { "id": "AG_JUG_CLAY", "name": "Jug, clay", "cost_cp": 3, "weight_lb": 9, "notes": "Holds 1 gallon." },
    { "id": "AG_LADDER_10FT", "name": "Ladder, 10-foot", "cost_cp": 5, "weight_lb": 20, "notes": "" },
    { "id": "AG_LAMP_COMMON", "name": "Lamp, common", "cost_sp": 1, "weight_lb": 1, "notes": "Bright 15 ft., shadowy 30 ft.; 6h per pint of oil." },
    { "id": "AG_LANTERN_BULLSEYE", "name": "Lantern, bullseye", "cost_gp": 12, "weight_lb": 3, "notes": "Bright 60-ft cone; shadowy 120 ft.; 6h/pint." },
    { "id": "AG_LANTERN_HOODED", "name": "Lantern, hooded", "cost_gp": 7, "weight_lb": 2, "notes": "Bright 30 ft.; shadowy 60 ft.; 6h/pint." },
    { "id": "AG_LOCK_SIMPLE", "name": "Lock, very simple", "cost_gp": 20, "weight_lb": 1, "notes": "Open Lock DC 20." },
    { "id": "AG_LOCK_AVERAGE", "name": "Lock, average", "cost_gp": 40, "weight_lb": 1, "notes": "Open Lock DC 25." },
    { "id": "AG_LOCK_GOOD", "name": "Lock, good", "cost_gp": 80, "weight_lb": 1, "notes": "Open Lock DC 30." },
    { "id": "AG_LOCK_SUPERIOR", "name": "Lock, amazing", "cost_gp": 150, "weight_lb": 1, "notes": "Open Lock DC 40." },
    { "id": "AG_MANACLES", "name": "Manacles", "cost_gp": 15, "weight_lb": 2, "notes": "Escape Artist DC 30; break DC 26." },
    { "id": "AG_MANACLES_MW", "name": "Manacles, masterwork", "cost_gp": 50, "weight_lb": 2, "notes": "Escape Artist DC 35; break DC 28." },
    { "id": "AG_MIRROR_SMALL_STEEL", "name": "Mirror, small steel", "cost_gp": 10, "weight_lb": 0.5, "notes": "" },
    { "id": "AG_MUG_TANKARD_CLAY", "name": "Mug/Tankard, clay", "cost_cp": 2, "weight_lb": 1, "notes": "" },
    { "id": "AG_OIL_1PINT", "name": "Oil (1-pint flask)", "cost_sp": 1, "weight_lb": 1, "notes": "" },
    { "id": "AG_PAPER_SHEET", "name": "Paper (sheet)", "cost_sp": 4, "weight_lb": 0, "notes": "" },
    { "id": "AG_PARCHMENT_SHEET", "name": "Parchment (sheet)", "cost_sp": 2, "weight_lb": 0, "notes": "" },
    { "id": "AG_PICK_MINERS", "name": "Pick, miner’s", "cost_gp": 3, "weight_lb": 10, "notes": "" },
    { "id": "AG_PITCHER_CLAY", "name": "Pitcher, clay", "cost_cp": 2, "weight_lb": 5, "notes": "" },
    { "id": "AG_PITON", "name": "Piton", "cost_sp": 1, "weight_lb": 0.5, "notes": "" },
    { "id": "AG_POLE_10FT", "name": "Pole, 10-foot", "cost_sp": 2, "weight_lb": 8, "notes": "" },
    { "id": "AG_POT_IRON", "name": "Pot, iron", "cost_sp": 5, "weight_lb": 10, "notes": "" },
    { "id": "AG_POUCH_BELT", "name": "Pouch, belt (empty)", "cost_gp": 1, "weight_lb": 0.5, "notes": "Counts as 1 lb when worn, where applicable." },
    { "id": "AG_RAM_PORTABLE", "name": "Ram, portable", "cost_gp": 10, "weight_lb": 20, "notes": "" },
    { "id": "AG_RATIONS_TRAIL_PER_DAY", "name": "Rations, trail (per day)", "cost_sp": 5, "weight_lb": 1, "notes": "Counts as 1 lb when worn, where applicable." },
    { "id": "AG_ROPE_HEMPEN_50FT", "name": "Rope, hempen (50 ft.)", "cost_gp": 1, "weight_lb": 10, "notes": "" },
    { "id": "AG_ROPE_SILK_50FT", "name": "Rope, silk (50 ft.)", "cost_gp": 10, "weight_lb": 5, "notes": "" },
    { "id": "AG_SACK_EMPTY", "name": "Sack (empty)", "cost_sp": 1, "weight_lb": 0.5, "notes": "Counts as 1 lb when worn, where applicable." },
    { "id": "AG_SEALING_WAX", "name": "Sealing wax", "cost_gp": 1, "weight_lb": 1, "notes": "" },
    { "id": "AG_SEWING_NEEDLE", "name": "Sewing needle", "cost_sp": 5, "weight_lb": 0, "notes": "" },
    { "id": "AG_SIGNAL_WHISTLE", "name": "Signal whistle", "cost_sp": 8, "weight_lb": 0, "notes": "" },
    { "id": "AG_SIGNET_RING", "name": "Signet ring", "cost_gp": 5, "weight_lb": 0, "notes": "" },
    { "id": "AG_SLEDGE", "name": "Sledge", "cost_gp": 1, "weight_lb": 10, "notes": "" },
    { "id": "AG_SOAP_PER_LB", "name": "Soap (per lb.)", "cost_sp": 5, "weight_lb": 1, "notes": "" },
    { "id": "AG_SPADE_SHOVEL", "name": "Spade or shovel", "cost_gp": 2, "weight_lb": 8, "notes": "" }
  ]
}
