{
  "source": "PHB v3.5",
  "chapter": "Magic",
  "section": "Spell List â€” Sorcerer/Wizard (Core, v1)",
  "schema_version": "1.0",
  "fields": ["id", "spell_id", "level"],
  "rows": [
    { "id": "LIST_SORWIZ_ACID_SPLASH", "spell_id": "SPELL_ACID_SPLASH", "level": 0 },
    { "id": "LIST_SORWIZ_MAGIC_MISSILE", "spell_id": "SPELL_MAGIC_MISSILE", "level": 1 },
    { "id": "LIST_SORWIZ_MAGE_ARMOR", "spell_id": "SPELL_MAGE_ARMOR", "level": 1 },
    { "id": "LIST_SORWIZ_SHIELD", "spell_id": "SPELL_SHIELD", "level": 1 },
    { "id": "LIST_SORWIZ_SLEEP", "spell_id": "SPELL_SLEEP", "level": 1 },
    { "id": "LIST_SORWIZ_CHARM_PERSON", "spell_id": "SPELL_CHARM_PERSON", "level": 1 },
    { "id": "LIST_SORWIZ_INVISIBILITY", "spell_id": "SPELL_INVISIBILITY", "level": 2 },
    { "id": "LIST_SORWIZ_FIREBALL", "spell_id": "SPELL_FIREBALL", "level": 3 },
    { "id": "LIST_SORWIZ_HASTE", "spell_id": "SPELL_HASTE", "level": 3 },
    { "id": "LIST_SORWIZ_SLOW", "spell_id": "SPELL_SLOW", "level": 3 },
    { "id": "LIST_SORWIZ_FLY", "spell_id": "SPELL_FLY", "level": 3 }
  ]
}
