{
"schema_version": "1.0",
"source": "MIC",
"chapter": "Magic Items",
"section": "Weapon Special Abilities (MIC)",
"fields": [
"id",
"name",
"category",
"costing",
"min_enhancement",
"stacking_rules",
"source",
"aura",
"required_caster_level",
"required_feat",
"required_spells"
],
"rows": [
{
"id": "mic-acidic-burst",
"name": "Acidic Burst",
"category": "Weapon",
"costing": "+1 bonus (Synergy; requires Corrosive)",
"min_enhancement": 1,
"stacking_rules": "Functions as Corrosive; on crit deals extra acid (x2 1d10, x3 2d10, x4 3d10). Burst works even if Corrosive not activated. Projectile weapons pass to ammo.",
"source": "MIC",
"aura": "Strong conjuration (DC 21)",
"required_caster_level": 12,
"required_feat": "Craft Magic Arms and Armor",
"required_spells": "Melf's acid arrow"
},
{
"id": "mic-arcane-might",
"name": "Arcane Might",
"category": "Bows (not crossbows)",
"costing": "+1 bonus",
"min_enhancement": 1,
"stacking_rules": "Swift action: sacrifice an arcane prepared spell/slot to add its level to the bow's next damage roll this turn.",
"source": "MIC",
"aura": "Strong transmutation (DC 22)",
"required_caster_level": 15,
"required_feat": "Craft Magic Arms and Armor",
"required_spells": "greater magic weapon"
},
{
"id": "mic-aquan",
"name": "Aquan",
"category": "Weapon",
"costing": "+2 bonus",
"min_enhancement": 1,
"stacking_rules": "Overcomes DR of fire-subtype creatures; +2d6 damage vs fire subtype. Fire-subtype wielders gain 1 negative level while wielded (can’t be removed while held). Projectile weapons pass to ammo.",
"source": "MIC",
"aura": "Moderate evocation (DC 18)",
"required_caster_level": 7,
"required_feat": "Craft Magic Arms and Armor",
"required_spells": ""
},
{
"id": "mic-aquatic",
"name": "Aquatic",
"category": "Weapon",
"costing": "2,000 gp (flat price)",
"min_enhancement": 0,
"stacking_rules": "No penalties for using the weapon underwater (as freedom of movement for weapon use).",
"source": "MIC",
"aura": "Moderate abjuration (DC 18)",
"required_caster_level": 7,
"required_feat": "Craft Magic Arms and Armor",
"required_spells": "freedom of movement"
},
{
"id": "mic-auran",
"name": "Auran",
"category": "Weapon",
"costing": "+2 bonus",
"min_enhancement": 1,
"stacking_rules": "Overcomes DR of earth-subtype creatures; +2d6 damage vs earth subtype. Earth-subtype wielders gain 1 negative level while wielded (can’t be removed while held). Projectile weapons pass to ammo.",
"source": "MIC",
"aura": "Moderate evocation (DC 18)",
"required_caster_level": 7,
"required_feat": "Craft Magic Arms and Armor",
"required_spells": ""
},
{
"id": "mic-banishing",
"name": "Banishing",
"category": "Weapon",
"costing": "+2 bonus",
"min_enhancement": 1,
"stacking_rules": "Free action on hit vs extraplanar creature (26 HD or fewer): banish (Will DC 20 negates). +2 DC for each alignment/material trait the weapon has that matches the target’s DR requirement. 3/day. Projectile weapons pass to ammo.",
"source": "MIC",
"aura": "Strong abjuration (DC 21)",
"required_caster_level": 13,
"required_feat": "Craft Magic Arms and Armor",
"required_spells": "banishment"
},
{
"id": "mic-berserker",
"name": "Berserker",
"category": "Two-handed melee weapon",
"costing": "+1 bonus",
"min_enhancement": 1,
"stacking_rules": "While raging, weapon deals +1d8 damage on each successful attack.",
"source": "MIC",
"aura": "Moderate enchantment (DC 18)",
"required_caster_level": 7,
"required_feat": "Craft Magic Arms and Armor",
"required_spells": "rage"
},
{
"id": "mic-binding",
"name": "Binding",
"category": "Weapon",
"costing": "+1 bonus",
"min_enhancement": 1,
"stacking_rules": "Swift action: your next successful hit before end of turn applies dimensional anchor for 10 minutes. 2/day. Projectile weapons pass to ammo.",
"source": "MIC",
"aura": "Moderate abjuration (DC 20)",
"required_caster_level": 10,
"required_feat": "Craft Magic Arms and Armor",
"required_spells": "dimensional anchor"
},
{
"id": "mic-blessed",
"name": "Blessed",
"category": "Weapon",
"costing": "+1 bonus",
"min_enhancement": 1,
"stacking_rules": "Counts as good-aligned for DR (continuous). 3/day swift: auto-confirm all crit threats vs evil foes for 1 round (as bless weapon). Doesn’t stack for extra benefit with other crit-confirm/keen/vorpal effects.",
"source": "MIC",
"aura": "Faint transmutation (DC 17)",
"required_caster_level": 5,
"required_feat": "Craft Magic Arms and Armor",
"required_spells": "bless weapon"
},
{
"id": "mic-blindsighted",
"name": "Blindsighted",
"category": "Weapon",
"costing": "+2 bonus",
"min_enhancement": 1,
"stacking_rules": "Std action to activate: wielder gains blindsight 30 ft for 1 minute; negated by silence. 3/day.",
"source": "MIC",
"aura": "Moderate divination (DC 18)",
"required_caster_level": 6,
"required_feat": "Craft Magic Arms and Armor",
"required_spells": ""
},
{
"id": "mic-bloodfeeding",
"name": "Bloodfeeding",
"category": "Melee weapon",
"costing": "+1 bonus",
"min_enhancement": 1,
"stacking_rules": "Each hit on a living creature grants 1 blood point (max 10; store 1 hour). On a hit, free action to spend up to 5 points for +2 damage per point; you don’t gain a point from that same strike.",
"source": "MIC",
"aura": "Moderate necromancy (DC 18)",
"required_caster_level": 7,
"required_feat": "Craft Magic Arms and Armor",
"required_spells": "vampiric touch"
},
{
"id": "mic-bloodstone",
"name": "Bloodstone",
"category": "Melee weapon",
"costing": "+1 bonus",
"min_enhancement": 1,
"stacking_rules": "As spell storing but only vampiric touch; any stored spell is automatically Empowered. Holds only one spell.",
"source": "MIC",
"aura": "Moderate necromancy (DC 20)",
"required_caster_level": 10,
"required_feat": "Craft Magic Arms and Armor; Empower Spell",
"required_spells": "vampiric touch"
},
{
"id": "mic-blurstrike",
"name": "Blurstrike",
"category": "Melee weapon",
"costing": "+2 bonus",
"min_enhancement": 1,
"stacking_rules": "Swift: for 1 round, target is treated as flat-footed against your first attack with this weapon. No effect vs blindsight users or uncanny dodge. 10/day.",
"source": "MIC",
"aura": "Moderate illusion (DC 18)",
"required_caster_level": 6,
"required_feat": "Craft Magic Arms and Armor",
"required_spells": "blur"
},
{
"id": "mic-brash",
"name": "Brash",
"category": "Melee weapon",
"costing": "+1 bonus",
"min_enhancement": 1,
"stacking_rules": "If you rage while wielding: rage lasts +3 rounds; while raging you are immune to fear.",
"source": "MIC",
"aura": "Faint abjuration (DC 17)",
"required_caster_level": 5,
"required_feat": "Craft Magic Arms and Armor",
"required_spells": "remove fear"
},
{
"id": "mic-brutal-surge",
"name": "Brutal Surge",
"category": "Melee weapon",
"costing": "+1 bonus",
"min_enhancement": 1,
"stacking_rules": "After a successful melee hit, swift action to bull rush target using your stats; if two-handed, +2 on opposed Str check. You don’t move with target; movement provokes AoOs from others only. Uses/day = 1 + your Con bonus; once used, no other creature can use it until next day.",
"source": "MIC",
"aura": "Moderate evocation (DC 20)",
"required_caster_level": 11,
"required_feat": "Craft Magic Arms and Armor",
"required_spells": "Bigby's forceful hand"
},
{
"id": "mic-bodyfeeder",
"name": "Bodyfeeder",
"category": "Weapon",
"costing": "+3 bonus",
"min_enhancement": 1,
"stacking_rules": "On a crit vs living target, gain temp HP equal to half the crit’s damage; lasts up to 1 minute; doesn’t stack with itself or other sources.",
"source": "MIC",
"aura": "Moderate necromancy (DC 19)",
"required_caster_level": 9,
"required_feat": "Craft Magic Arms and Armor",
"required_spells": "vampiric touch or claws of the vampire (EPH 84)"
}
]
}
